fable_number,title,text,moral,care.virtue,care.vice,fairness.virtue,fairness.vice,loyalty.virtue,loyalty.vice,authority.virtue,authority.vice,sanctity.virtue,sanctity.vice,dominant_moral,dominant_score
1,THE FOX AND THE GRAPES,"A hungry Fox saw some fine bunches of Grapes hanging from a vine that was trained along a high trellis, and did his best to reach them by jumping as high as he could into the air. But it was all in vain, for they were just out of reach: so he gave up trying, and walked away with an air of dignity and unconcern, remarking, ""I thought those Grapes were ripe, but I see now they are quite sour.""",,0.22650012,0.2532062,0.2311595,0.29803488,0.27040535,0.26345363,0.24561603,0.26674008,0.26966506,0.34530243,sanctity.vice,0.34530243
2,THE GOOSE THAT LAID THE GOLDEN EGGS,"A Man and his Wife had the good fortune to possess a Goose which laid a Golden Egg every day. Lucky though they were, they soon began to think they were not getting rich fast enough, and, imagining the bird must be made of gold inside, they decided to kill it in order to secure the whole store of precious metal at once. But when they cut it open they found it was just like any other goose. Thus, they neither got rich all at once, as they had hoped, nor enjoyed any longer the daily addition to their wealth",Much wants more and loses all.,0.2515609,0.20068084,0.22745888,0.26165146,0.26628795,0.222719,0.24558738,0.18837012,0.26133177,0.30130535,sanctity.vice,0.30130535
3,THE CAT AND THE MICE,"There was once a house that was overrun with Mice. A Cat heard of this, and said to herself, ""That's the place for me,"" and off she went and took up her quarters in the house, and caught the Mice one by one and ate them. At last the Mice could stand it no longer, and they determined to take to their holes and stay there. ""That's awkward,"" said the Cat to herself: ""the only thing to do is to coax them out by a trick."" So she considered a while, and then climbed up the wall and let herself hang down by her hind legs from a peg, and pretended to be dead. By and by a Mouse peeped out and saw the Cat hanging there. ""Aha!"" it cried, ""you're very clever, madam, no doubt: but you may turn yourself into a bag of meal hanging there, if you like, yet you won't catch us coming anywhere near you."" If you are wise you won't be deceived by the innocent airs of those whom you have once found to be dangerous.",,0.32085592,0.3873979,0.28421175,0.34005442,0.34198284,0.34015623,0.3474801,0.29954067,0.3631544,0.39115235,sanctity.vice,0.39115235
4,THE MISCHIEVOUS DOG,"There was once a Dog who used to snap at people and bite them without any provocation, and who was a great nuisance to every one who came to his master's house. So his master fastened a bell round his neck to warn people of his presence. The Dog was very proud of the bell, and strutted about tinkling it with immense satisfaction. But an old dog came up to him and said, ""The fewer airs you give yourself the better, my friend. You don't think, do you, that your bell was given you as a reward of merit? On the contrary, it is a badge of disgrace."" Notoriety is often mistaken for fame.",,0.3772952,0.4309812,0.35848507,0.40313306,0.39008218,0.38639998,0.45508575,0.3913373,0.41586927,0.4362391,authority.virtue,0.45508575
5,THE CHARCOAL-BURNER AND THE FULLER,"There was once a Charcoal-burner who lived and worked by himself. A Fuller, however, happened to come and settle in the same neighbourhood; and the Charcoal-burner, having made his acquaintance and finding he was an agreeable sort of fellow, asked him if he would come and share his house: ""We shall get to know one another better that way,"" he said, ""and, beside, our household expenses will be diminished."" The Fuller thanked him, but replied, ""I couldn't think of it, sir: why, everything I take such pains to whiten would be blackened in no time by your charcoal.""",,0.41812557,0.33664685,0.40072748,0.35421613,0.4365912,0.33159053,0.41064435,0.32178375,0.4083569,0.3780039,loyalty.virtue,0.4365912
6,THE MICE IN COUNCIL,"Once upon a time all the Mice met together in Council, and discussed the best means of securing themselves against the attacks of the cat. After several suggestions had been debated, a Mouse of some standing and experience got up and said, ""I think I have hit upon a plan which will ensure our safety in the future, provided you approve and carry it out. It is that we should fasten a bell round the neck of our enemy the cat, which will by its tinkling warn us of her approach."" This proposal was warmly applauded, and it had been already decided to adopt it, when an old Mouse got upon his feet and said, ""I agree with you all that the plan before us is an admirable one: but may I ask who is going to bell the cat?""",,0.38380685,0.31460536,0.3494866,0.3103999,0.44392926,0.32645735,0.40252104,0.28953165,0.38939112,0.35004324,loyalty.virtue,0.44392926
7,THE BAT AND THE WEASELS,"A Bat fell to the ground and was caught by a Weasel, and was just going to be killed and eaten when it begged to be let go. The Weasel said he couldn't do that because he was an enemy of all birds on principle. ""Oh, but,"" said the Bat, ""I'm not a bird at all: I'm a mouse."" ""So you are,"" said the Weasel, ""now I come to look at you""; and he let it go. Some time after this the Bat was caught in just the same way by another Weasel, and, as before, begged for its life. ""No,"" said the Weasel, ""I never let a mouse go by any chance."" ""But I'm not a mouse,"" said the Bat; ""I'm a bird."" ""Why, so you are,"" said the Weasel; and he too let the Bat go. Look and see which way the wind blows before you commit yourself.",,0.28791222,0.25769237,0.26497582,0.25109208,0.2681828,0.3002817,0.27648425,0.27551684,0.3005954,0.29235718,sanctity.virtue,0.3005954
8,THE DOG AND THE SOW,"A Dog and a Sow were arguing and each claimed that its own young ones were finer than those of any other animal. ""Well,"" said the Sow at last, ""mine can see, at any rate, when they come into the world: but yours are born blind.""",,0.31919226,0.3593823,0.3848301,0.4030964,0.39876178,0.38116977,0.38931394,0.37562886,0.41301823,0.43534893,sanctity.vice,0.43534893
9,THE FOX AND THE CROW,"A Crow was sitting on a branch of a tree with a piece of cheese in her beak when a Fox observed her and set his wits to work to discover some way of getting the cheese. Coming and standing under the tree he looked up and said, ""What a noble bird I see above me! Her beauty is without equal, the hue of her plumage exquisite. If only her voice is as sweet as her looks are fair, she ought without doubt to be Queen of the Birds."" The Crow was hugely flattered by this, and just to show the Fox that she could sing she gave a loud caw. Down came the cheese, of course, and the Fox, snatching it up, said, ""You have a voice, madam, I see: what you want is wits.""",,0.29006806,0.24914603,0.26962128,0.28586507,0.29761443,0.25390306,0.34159207,0.24516104,0.3479353,0.33631006,sanctity.virtue,0.3479353
10,THE HORSE AND THE GROOM,"There was once a Groom who used to spend long hours clipping and combing the Horse of which he had charge, but who daily stole a portion of his allowance of oats, and sold it for his own profit. The Horse gradually got into worse and worse condition, and at last cried to the Groom, ""If you really want me to look sleek and well, you must comb me less and feed me more.""",,0.26966956,0.23075813,0.17563646,0.20835216,0.18384685,0.21100333,0.23811424,0.182578,0.20455103,0.24591643,care.virtue,0.26966956
11,THE WOLF AND THE LAMB,"A Wolf came upon a Lamb straying from the flock, and felt some compunction about taking the life of so helpless a creature without some plausible excuse; so he cast about for a grievance and said at last, ""Last year, sirrah, you grossly insulted me."" ""That is impossible, sir,"" bleated the Lamb, ""for I wasn't born then."" ""Well,"" retorted the Wolf, ""you feed in my pastures."" ""That cannot be,"" replied the Lamb, ""for I have never yet tasted grass."" ""You drink from my spring, then,"" continued the Wolf. ""Indeed, sir,"" said the poor Lamb, ""I have never yet drunk anything but my mother's milk."" ""Well, anyhow,"" said the Wolf, ""I'm not going without my dinner"": and he sprang upon the Lamb and devoured it without more ado.",,0.24261858,0.219275,0.20550781,0.17608437,0.1750991,0.18627203,0.17158097,0.24425128,0.20915365,0.23598175,authority.vice,0.24425128
12,THE PEACOCK AND THE CRANE,"A Peacock taunted a Crane with the dullness of her plumage. ""Look at my brilliant colours,"" said she, ""and see how much finer they are than your poor feathers."" ""I am not denying,"" replied the Crane, ""that yours are far gayer than mine; but when it comes to flying I can soar into the clouds, whereas you are confined to the earth like any dunghill cock.""",,0.35023972,0.30922136,0.34845093,0.3103219,0.31699848,0.26803562,0.3683679,0.26649407,0.4003693,0.39959696,sanctity.virtue,0.4003693
13,THE CAT AND THE BIRDS,"A Cat heard that the Birds in an aviary were ailing. So he got himself up as a doctor, and, taking with him a set of the instruments proper to his profession, presented himself at the door, and inquired after the health of the Birds. ""We shall do very well,"" they replied, without letting him in, ""when we've seen the last of you."" A villain may disguise himself, but he will not deceive the wise.",,0.36627012,0.31844652,0.32940733,0.30732945,0.34132668,0.30957702,0.36442998,0.28185043,0.38114637,0.34225494,sanctity.virtue,0.38114637
14,THE SPENDTHRIFT AND THE SWALLOW,"A Spendthrift, who had wasted his fortune, and had nothing left but the clothes in which he stood, saw a Swallow one fine day in early spring. Thinking that summer had come, and that he could now do without his coat, he went and sold it for what it would fetch. A change, however, took place in the weather, and there came a sharp frost which killed the unfortunate Swallow. When the Spendthrift saw its dead body he cried, ""Miserable bird! Thanks to you I am perishing of cold myself."" One swallow does not make summer.",,0.29393435,0.26804852,0.259972,0.27572373,0.25178957,0.29785556,0.27733123,0.2546628,0.331555,0.3850679,sanctity.vice,0.3850679
15,THE OLD WOMAN AND THE DOCTOR,"An Old Woman became almost totally blind from a disease of the eyes, and, after consulting a Doctor, made an agreement with him in the presence of witnesses that she should pay him a high fee if he cured her, while if he failed he was to receive nothing. The Doctor accordingly prescribed a course of treatment, and every time he paid her a visit he took away with him some article out of the house, until at last, when he visited her for the last time, and the cure was complete, there was nothing left. When the Old Woman saw that the house was empty she refused to pay him his fee; and, after repeated refusals on her part, he sued her before the magistrates for payment of her debt. On being brought into court she was ready with her defence. ""The claimant,"" said she, ""has stated the facts about our agreement correctly. I undertook to pay him a fee if he cured me, and he, on his part, promised to charge nothing if he failed. Now, he says I am cured; but I say that I am blinder than ever, and I can prove what I say. When my eyes were bad I could at any rate see well enough to be aware that my house contained a certain amount of furniture and other things; but now, when according to him I am cured, I am entirely unable to see anything there at all.""",,0.40248,0.2852882,0.39631692,0.23303917,0.31681854,0.2239057,0.35629162,0.22035006,0.3856912,0.28348243,care.virtue,0.40248
16,THE MOON AND HER MOTHER,"The Moon once begged her Mother to make her a gown. ""How can I?"" replied she; ""there's no fitting your figure. At one time you're a New Moon, and at another you're a Full Moon; and between whiles you're neither one nor the other.""",,0.24447143,0.18863016,0.23548524,0.23267269,0.19388211,0.206206,0.23162162,0.26005656,0.2979817,0.21777298,sanctity.virtue,0.2979817
17,MERCURY AND THE WOODMAN,"A Woodman was felling a tree on the bank of a river, when his axe, glancing off the trunk, flew out of his hands and fell into the water. As he stood by the water's edge lamenting his loss, Mercury appeared and asked him the reason for his grief; and on learning what had happened, out of pity for his distress he dived into the river and, bringing up a golden axe, asked him if that was the one he had lost. The Woodman replied that it was not, and Mercury then dived a second time, and, bringing up a silver axe, asked if that was his. ""No, that is not mine either,"" said the Woodman. Once more Mercury dived into the river, and brought up the missing axe. The Woodman was overjoyed at recovering his property, and thanked his benefactor warmly; and the latter was so pleased with his honesty that he made him a present of the other two axes. When the Woodman told the story to his companions, one of these was filled with envy of his good fortune and determined to try his luck for himself. So he went and began to fell a tree at the edge of the river, and presently contrived to let his axe drop into the water. Mercury appeared as before, and, on learning that his axe had fallen in, he dived and brought up a golden axe, as he had done on the previous occasion. Without waiting to be asked whether it was his or not the fellow cried, ""That's mine, that's mine,"" and stretched out his hand eagerly for the prize: but Mercury was so disgusted at his dishonesty that he not only declined to give him the golden axe, but also refused to recover for him the one he had let fall into the stream. Honesty is the best policy.",,0.40116137,0.244482,0.3581078,0.23430315,0.278929,0.2674067,0.3316349,0.2296183,0.37006846,0.25020298,care.virtue,0.40116137
18,"THE ASS, THE FOX, AND THE LION","An Ass and a Fox went into partnership and sallied out to forage for food together. They hadn't gone far before they saw a Lion coming their way, at which they were both dreadfully frightened. But the Fox thought he saw a way of saving his own skin, and went boldly up to the Lion and whispered in his ear, ""I'll manage that you shall get hold of the Ass without the trouble of stalking him, if you'll promise to let me go free."" The Lion agreed to this, and the Fox then rejoined his companion and contrived before long to lead him by a hidden pit, which some hunter had dug as a trap for wild animals, and into which he fell. When the Lion saw that the Ass was safely caught and couldn't get away, it was to the Fox that he first turned his attention, and he soon finished him off, and then at his leisure proceeded to feast upon the Ass","Betray a friend, and you'll often find you have ruined yourself.",0.38106298,0.2972865,0.32398593,0.3094463,0.40462115,0.32686532,0.35362655,0.25889543,0.31490847,0.31725466,loyalty.virtue,0.40462115
19,THE LION AND THE MOUSE,"A Lion asleep in his lair was waked up by a Mouse running over his face. Losing his temper he seized it with his paw and was about to kill it. The Mouse, terrified, piteously entreated him to spare its life. ""Please let me go,"" it cried, ""and one day I will repay you for your kindness."" The idea of so insignificant a creature ever being able to do anything for him amused the Lion so much that he laughed aloud, and good-humouredly let it go. But the Mouse's chance came, after all. One day the Lion got entangled in a net which had been spread for game by some hunters, and the Mouse heard and recognised his roars of anger and ran to the spot. Without more ado it set to work to gnaw the ropes with its teeth, and succeeded before long in setting the Lion free. ""There!"" said the Mouse, ""you laughed at me when I promised I would repay you: but now you see, even a Mouse can help a Lion.""",,0.40835285,0.35682932,0.3293278,0.3114136,0.33568004,0.33811545,0.36850446,0.30011046,0.38384002,0.35839033,care.virtue,0.40835285
20,THE CROW AND THE PITCHER,"A thirsty Crow found a Pitcher with some water in it, but so little was there that, try as she might, she could not reach it with her beak, and it seemed as though she would die of thirst within sight of the remedy. At last she hit upon a clever plan. She began dropping pebbles into the Pitcher, and with each pebble the water rose a little higher until at last it reached the brim, and the knowing bird was enabled to quench her thirst. Necessity is the mother of invention.",,0.3209026,0.2998294,0.2665733,0.2887424,0.2801254,0.2385319,0.33809036,0.26430407,0.35952255,0.385395,sanctity.vice,0.385395
21,THE BOYS AND THE FROGS,"Some mischievous Boys were playing on the edge of a pond, and, catching sight of some Frogs swimming about in the shallow water, they began to amuse themselves by pelting them with stones, and they killed several of them. At last one of the Frogs put his head out of the water and said, ""Oh, stop! stop! I beg of you: what is sport to you is death to us.""",,0.12122098,0.24779941,0.15151384,0.2515926,0.19951677,0.2388733,0.17241102,0.20951666,0.18106465,0.29042214,sanctity.vice,0.29042214
22,THE NORTH WIND AND THE SUN,"A dispute arose between the North Wind and the Sun, each claiming that he was stronger than the other. At last they agreed to try their powers upon a traveller, to see which could soonest strip him of his cloak. The North Wind had the first try; and, gathering up all his force for the attack, he came whirling furiously down upon the man, and caught up his cloak as though he would wrest it from him by one single effort: but the harder he blew, the more closely the man wrapped it round himself. Then came the turn of the Sun. At first he beamed gently upon the traveller, who soon unclasped his cloak and walked on with it hanging loosely about his shoulders: then he shone forth in his full strength, and the man, before he had gone many steps, was glad to throw his cloak right off and complete his journey more lightly clad",Persuasion is better than force,0.33701816,0.36187115,0.38287178,0.35786855,0.42964822,0.36648467,0.43656918,0.37591213,0.39400584,0.34262544,authority.virtue,0.43656918
23,THE MISTRESS AND HER SERVANTS,"A Widow, thrifty and industrious, had two servants, whom she kept pretty hard at work. They were not allowed to lie long abed in the mornings, but the old lady had them up and doing as soon as the cock crew. They disliked intensely having to get up at such an hour, especially in winter-time: and they thought that if it were not for the cock waking up their Mistress so horribly early, they could sleep longer. So they caught it and wrung its neck. But they weren't prepared for the consequences. For what happened was that their Mistress, not hearing the cock crow as usual, waked them up earlier than ever, and set them to work in the middle of the night.",,0.39619765,0.4546919,0.32102534,0.33881196,0.43864536,0.31333244,0.44785696,0.35719478,0.42626694,0.40974608,care.vice,0.4546919
24,THE GOODS AND THE ILLS,"There was a time in the youth of the world when Goods and Ills entered equally into the concerns of men, so that the Goods did not prevail to make them altogether blessed, nor the Ills to make them wholly miserable. But owing to the foolishness of mankind the Ills multiplied greatly in number and increased in strength, until it seemed as though they would deprive the Goods of all share in human affairs, and banish them from the earth. The latter, therefore, betook themselves to heaven and complained to Jupiter of the treatment they had received, at the same time praying him to grant them protection from the Ills, and to advise them concerning the manner of their intercourse with men. Jupiter granted their request for protection, and decreed that for the future they should not go among men openly in a body, and so be liable to attack from the hostile Ills, but singly and unobserved, and at infrequent and unexpected intervals. Hence it is that the earth is full of Ills, for they come and go as they please and are never far away; while Goods, alas! come one by one only, and have to travel all the way from heaven, so that they are very seldom seen.",,0.41334003,0.38354892,0.38751522,0.34034374,0.43138513,0.35500005,0.3832739,0.36661956,0.38721734,0.3546636,loyalty.virtue,0.43138513
25,THE HARES AND THE FROGS,"The Hares once gathered together and lamented the unhappiness of their lot, exposed as they were to dangers on all sides and lacking the strength and the courage to hold their own. Men, dogs, birds and beasts of prey were all their enemies, and killed and devoured them daily: and sooner than endure such persecution any longer, they one and all determined to end their miserable lives. Thus resolved and desperate, they rushed in a body towards a neighbouring pool, intending to drown themselves. On the bank were sitting a number of Frogs, who, when they heard the noise of the Hares as they ran, with one accord leaped into the water and hid themselves in the depths. Then one of the older Hares who was wiser than the rest cried out to his companions, ""Stop, my friends, take heart; don't let us destroy ourselves after all: see, here are creatures who are afraid of us, and who must, therefore, be still more timid than ourselves.""",,0.41533864,0.42590806,0.37056056,0.32288665,0.46559954,0.376578,0.40726864,0.34872562,0.37995195,0.36092627,loyalty.virtue,0.46559954
26,THE FOX AND THE STORK,"A Fox invited a Stork to dinner, at which the only fare provided was a large flat dish of soup. The Fox lapped it up with great relish, but the Stork with her long bill tried in vain to partake of the savoury broth. Her evident distress caused the sly Fox much amusement. But not long after the Stork invited him in turn, and set before him a pitcher with a long and narrow neck, into which she could get her bill with ease. Thus, while she enjoyed her dinner, the Fox sat by hungry and helpless, for it was impossible for him to reach the tempting contents of the vessel.",,0.2088312,0.20494072,0.19464037,0.257309,0.23164025,0.21776745,0.21725346,0.2034354,0.20853831,0.3024282,sanctity.vice,0.3024282
27,THE WOLF IN SHEEP'S CLOTHING,"A Wolf resolved to disguise himself in order that he might prey upon a flock of sheep without fear of detection. So he clothed himself in a sheepskin, and slipped among the sheep when they were out at pasture. He completely deceived the shepherd, and when the flock was penned for the night he was shut in with the rest. But that very night as it happened, the shepherd, requiring a supply of mutton for the table, laid hands on the Wolf in mistake for a Sheep, and killed him with his knife on the spot.",,0.2412856,0.33040637,0.23593111,0.3248603,0.30785418,0.32403746,0.29460666,0.23649089,0.25333947,0.32754472,care.vice,0.33040637
28,THE STAG IN THE OX-STALL,"A Stag, chased from his lair by the hounds, took refuge in a farmyard, and, entering a stable where a number of oxen were stalled, thrust himself under a pile of hay in a vacant stall, where he lay concealed, all but the tips of his horns. Presently one of the Oxen said to him, ""What has induced you to come in here? Aren't you aware of the risk you are running of being captured by the herdsmen?"" To which he replied, ""Pray let me stay for the present. When night comes I shall easily escape under cover of the dark."" In the course of the afternoon more than one of the farm-hands came in, to attend to the wants of the cattle, but not one of them noticed the presence of the Stag, who accordingly began to congratulate himself on his escape and to express his gratitude to the Oxen. ""We wish you well,"" said the one who had spoken before, ""but you are not out of danger yet. If the master comes, you will certainly be found out, for nothing ever escapes his keen eyes."" Presently, sure enough, in he came, and made a great to-do about the way the Oxen were kept. ""The beasts are starving,"" he cried; ""here, give them more hay, and put plenty of litter under them."" As he spoke, he seized an armful himself from the pile where the Stag lay concealed, and at once detected him. Calling his men, he had him seized at once and killed for the table.",,0.37651885,0.32279524,0.2978547,0.2895,0.34764296,0.32695267,0.37662718,0.25560525,0.35045248,0.3211817,authority.virtue,0.37662718
29,THE MILKMAID AND HER PAIL,"A farmer's daughter had been out to milk the cows, and was returning to the dairy carrying her pail of milk upon her head. As she walked along, she fell a-musing after this fashion: ""The milk in this pail will provide me with cream, which I will make into butter and take to market to sell. With the money I will buy a number of eggs, and these, when hatched, will produce chickens, and by and by I shall have quite a large poultry-yard. Then I shall sell some of my fowls, and with the money which they will bring in I will buy myself a new gown, which I shall wear when I go to the fair; and all the young fellows will admire it, and come and make love to me, but I shall toss my head and have nothing to say to them."" Forgetting all about the pail, and suiting the action to the word, she tossed her head. Down went the pail, all the milk was spilled, and all her fine castles in the air vanished in a moment! Do not count your chickens before they are hatched.",,0.18341511,0.07632202,0.092145555,0.08876025,0.11321146,0.09696118,0.16036819,0.05693972,0.18699218,0.15075701,sanctity.virtue,0.18699218
