fable_number,title,text,moral,care.virtue,care.vice,fairness.virtue,fairness.vice,loyalty.virtue,loyalty.vice,authority.virtue,authority.vice,sanctity.virtue,sanctity.vice,dominant_moral,dominant_score
127,THE CLOWN AND THE COUNTRYMAN,"A Nobleman announced his intention of giving a public entertainment in the theatre, and offered splendid prizes to all who had any novelty to exhibit at the performance. The announcement attracted a crowd of conjurers, jugglers, and acrobats, and among the rest a Clown, very popular with the crowd, who let it be known that he was going to give an entirely new turn. When the day of the performance came, the theatre was filled from top to bottom some time before the entertainment began. Several performers exhibited their tricks, and then the popular favourite came on empty-handed and alone. At once there was a hush of expectation: and he, letting his head fall upon his breast, imitated the squeak of a pig to such perfection that the audience insisted on his producing the animal, which, they said, he must have somewhere concealed about his person. He, however, convinced them that there was no pig there, and then the applause was deafening. Among the spectators was a Countryman, who disparaged the Clown's performance and announced that he would give a much superior exhibition of the same trick on the following day. Again the theatre was filled to overflowing, and again the Clown gave his imitation amidst the cheers of the crowd. The Countryman, meanwhile, before going on the stage, had secreted a young porker under his smock; and when the spectators derisively bade him do better if he could, he gave it a pinch in the ear and made it squeal loudly. But they all with one voice shouted out that the Clown's imitation was much more true to life. Thereupon he produced the pig from under his smock and said sarcastically, ""There, that shows what sort of judges you are!""",,0.3151183,0.36937436,0.38002262,0.38298726,0.40955222,0.39150187,0.42715248,0.38199577,0.4020309,0.43218073,sanctity.vice,0.43218073
128,THE LARK AND THE FARMER,"A Lark nested in a field of corn, and was rearing her brood under cover of the ripening grain. One day, before the young were fully fledged, the Farmer came to look at the crop, and, finding it yellowing fast, he said, ""I must send round word to my neighbours to come and help me reap this field."" One of the young Larks overheard him, and was very much frightened, and asked her mother whether they hadn't better move house at once. ""There's no hurry,"" replied she; ""a man who looks to his friends for help will take his time about a thing."" In a few days the Farmer came by again, and saw that the grain was overripe and falling out of the ears upon the ground. ""I must put it off no longer,"" he said; ""This very day I'll hire the men and set them to work at once."" The Lark heard him and said to her young, ""Come, my children, we must be off: he talks no more of his friends now, but is going to take things in hand himself."" Self-help is the best help.",,0.45897767,0.33699208,0.35731083,0.27905267,0.40315947,0.28769508,0.39867204,0.28213948,0.39758134,0.34034693,care.virtue,0.45897767
129,THE LION AND THE ASS,"A Lion and an Ass set up as partners and went a-hunting together. In course of time they came to a cave in which there were a number of wild goats. The Lion took up his stand at the mouth of the cave, and waited for them to come out; while the Ass went inside and brayed for all he was worth in order to frighten them out into the open. The Lion struck them down one by one as they appeared; and when the cave was empty the Ass came out and said, ""Well, I scared them pretty well, didn't I?"" ""I should think you did,"" said the Lion: ""why, if I hadn't known you were an Ass, I should have turned and run myself.""",,0.29129967,0.24042436,0.2707624,0.2635364,0.33754215,0.3063261,0.2896883,0.24286383,0.26287904,0.23812297,loyalty.virtue,0.33754215
130,THE PROPHET,"A Prophet sat in the market-place and told the fortunes of all who cared to engage his services. Suddenly there came running up one who told him that his house had been broken into by thieves, and that they had made off with everything they could lay hands on. He was up in a moment, and rushed off, tearing his hair and calling down curses on the miscreants. The bystanders were much amused, and one of them said, ""Our friend professes to know what is going to happen to others, but it seems he's not clever enough to perceive what's in store for himself.""",,0.28080624,0.2738079,0.26238042,0.3165972,0.28681394,0.36360952,0.3094308,0.2993581,0.36165917,0.2945687,loyalty.vice,0.36360952
131,THE HOUND AND THE HARE,"A young Hound started a Hare, and, when he caught her up, would at one moment snap at her with his teeth as though he were about to kill her, while at another he would let go his hold and frisk about her, as if he were playing with another dog. At last the Hare said, ""I wish you would show yourself in your true colours! If you are my friend, why do you bite me? If you are my enemy, why do you play with me?"" He is no friend who plays double.",,0.35796875,0.33074442,0.31393835,0.27469108,0.34248582,0.27436605,0.35386345,0.20092233,0.3155557,0.2696799,care.virtue,0.35796875
132,"THE LION, THE MOUSE, AND THE FOX","A Lion was lying asleep at the mouth of his den when a Mouse ran over his back and tickled him so that he woke up with a start and began looking about everywhere to see what it was that had disturbed him. A Fox, who was looking on, thought he would have a joke at the expense of the Lion; so he said, ""Well, this is the first time I've seen a Lion afraid of a Mouse."" ""Afraid of a Mouse?"" said the Lion testily: ""not I! It's his bad manners I can't stand.""",,0.27815711,0.290472,0.24917759,0.26868656,0.2445191,0.28140152,0.28379375,0.2561583,0.2730002,0.3095672,sanctity.vice,0.3095672
133,THE TRUMPETER TAKEN PRISONER,"A Trumpeter marched into battle in the van of the army and put courage into his comrades by his warlike tunes. Being captured by the enemy, he begged for his life, and said, ""Do not put me to death; I have killed no one: indeed, I have no weapons, but carry with me only my trumpet here."" But his captors replied, ""That is only the more reason why we should take your life; for, though you do not fight yourself, you stir up others to do so.""",,0.4165797,0.39706293,0.3797207,0.31408104,0.4400892,0.4288345,0.38690042,0.37621826,0.3593822,0.2855676,loyalty.virtue,0.4400892
134,THE WOLF AND THE CRANE,"A Wolf once got a bone stuck in his throat. So he went to a Crane and begged her to put her long bill down his throat and pull it out. ""I'll make it worth your while,"" he added. The Crane did as she was asked, and got the bone out quite easily. The Wolf thanked her warmly, and was just turning away, when she cried, ""What about that fee of mine?"" ""Well, what about it?"" snapped the Wolf, baring his teeth as he spoke; ""you can go about boasting that you once put your head into a Wolf's mouth and didn't get it bitten off. What more do you want?""",,0.38916704,0.3062526,0.34127033,0.27176708,0.3049319,0.28183025,0.33527377,0.29650596,0.37007827,0.34569204,care.virtue,0.38916704
135,"THE EAGLE, THE CAT, AND THE WILD SOW","An Eagle built her nest at the top of a high tree; a Cat with her family occupied a hollow in the trunk half-way down; and a Wild Sow and her young took up their quarters at the foot. They might have got on very well as neighbours had it not been for the evil cunning of the Cat. Climbing up to the Eagle's nest she said to the Eagle, ""You and I are in the greatest possible danger. That dreadful creature, the Sow, who is always to be seen grubbing away at the foot of the tree, means to uproot it, that she may devour your family and mine at her ease."" Having thus driven the Eagle almost out of her senses with terror, the Cat climbed down the tree, and said to the Sow, ""I must warn you against that dreadful bird, the Eagle. She is only waiting her chance to fly down and carry off one of your little pigs when you take them out, to feed her brood with."" She succeeded in frightening the Sow as much as the Eagle. Then she returned to her hole in the trunk, from which, feigning to be afraid, she never came forth by day. Only by night did she creep out unseen to procure food for her kittens. The Eagle, meanwhile was afraid to stir from her nest, and the Sow dared not leave her home among the roots: so that in time both they and their families perished of hunger, and their dead bodies supplied the Cat with ample food for her growing family.",,0.36543706,0.29376706,0.28342524,0.28929684,0.3625061,0.2917586,0.34202984,0.2597183,0.33807686,0.3192432,care.virtue,0.36543706
136,THE WOLF AND THE SHEEP,"A Wolf was worried and badly bitten by dogs, and lay a long time for dead. By and by he began to revive, and, feeling very hungry, called out to a passing Sheep and said, ""Would you kindly bring me some water from the stream close by? I can manage about meat, if only I could get something to drink."" But this Sheep was no fool. ""I can quite understand"", said he, ""that if I brought you the water, you would have no difficulty about the meat. Good-morning.""",,0.24469984,0.18142316,0.15208581,0.07241,0.11663809,0.10160383,0.16531877,0.10165187,0.21314391,0.18468015,care.virtue,0.24469984
137,THE TUNNY-FISH AND THE DOLPHIN,"A Tunny-fish was chased by a Dolphin and splashed through the water at a great rate, but the Dolphin gradually gained upon him, and was just about to seize him when the force of his flight carried the Tunny on to a sandbank. In the heat of the chase the Dolphin followed him, and there they both lay out of the water, gasping for dear life. When the Tunny saw that his enemy was doomed like himself, he said, ""I don't mind having to die now: for I see that he who is the cause of my death is about to share the same fate.""",,0.35312134,0.33627266,0.3154934,0.22715259,0.3383399,0.25627285,0.32635298,0.23316912,0.32248935,0.31872782,care.virtue,0.35312134
138,THE THREE TRADESMEN,"The citizens of a certain city were debating about the best material to use in the fortifications which were about to be erected for the greater security of the town. A Carpenter got up and advised the use of wood, which he said was readily procurable and easily worked. A Stone-mason objected to wood on the ground that it was so inflammable, and recommended stones instead. Then a Tanner got on his legs and said, ""In my opinion there's nothing like leather."" Every man for himself.",,0.28016844,0.21952432,0.26828253,0.17395401,0.25789243,0.19983163,0.25740358,0.22271627,0.2787456,0.20277447,care.virtue,0.28016844
139,THE MOUSE AND THE BULL,"A Bull gave chase to a Mouse which had bitten him in the nose: but the Mouse was too quick for him and slipped into a hole in a wall. The Bull charged furiously into the wall again and again until he was tired out, and sank down on the ground exhausted with his efforts. When all was quiet, the Mouse darted out and bit him again. Beside himself with rage he started to his feet, but by that time the Mouse was back in his hole again, and he could do nothing but bellow and fume in helpless anger. Presently he heard a shrill little voice say from inside the wall, ""You big fellows don't always have it your own way, you see: sometimes we little ones come off best."" The battle is not always to the strong.",,0.324418,0.41884884,0.3326804,0.3507748,0.3928029,0.36789513,0.38132417,0.39980924,0.35515904,0.3911845,care.vice,0.41884884
140,THE HARE AND THE HOUND,"A Hound started a Hare from her form, and pursued her for some distance; but as she gradually gained upon him, he gave up the chase. A rustic who had seen the race met the Hound as he was returning, and taunted him with his defeat. ""The little one was too much for you,"" said he. ""Ah, well,"" said the Hound, ""don't forget it's one thing to be running for your dinner, but quite another to be running for your life.""",,0.38235494,0.3533623,0.3402972,0.3033809,0.35309795,0.32623586,0.3770152,0.30280992,0.31988296,0.31751594,care.virtue,0.38235494
141,THE TOWN MOUSE AND THE COUNTRY MOUSE,"A Town Mouse and a Country Mouse were acquaintances, and the Country Mouse one day invited his friend to come and see him at his home in the fields. The Town Mouse came, and they sat down to a dinner of barleycorns and roots, the latter of which had a distinctly earthy flavour. The fare was not much to the taste of the guest, and presently he broke out with ""My poor dear friend, you live here no better than the ants. Now, you should just see how I fare! My larder is a regular horn of plenty. You must come and stay with me, and I promise you you shall live on the fat of the land."" So when he returned to town he took the Country Mouse with him, and showed him into a larder containing flour and oatmeal and figs and honey and dates. The Country Mouse had never seen anything like it, and sat down to enjoy the luxuries his friend provided: but before they had well begun, the door of the larder opened and some one came in. The two Mice scampered off and hid themselves in a narrow and exceedingly uncomfortable hole. Presently, when all was quiet, they ventured out again; but some one else came in, and off they scuttled again. This was too much for the visitor. ""Good-bye,"" said he, ""I'm off. You live in the lap of luxury, I can see, but you are surrounded by dangers; whereas at home I can enjoy my simple dinner of roots and corn in peace.""",,0.24343866,0.17542063,0.19635251,0.17966378,0.28370395,0.2012687,0.22877869,0.18263885,0.22964036,0.20808613,loyalty.virtue,0.28370395
142,THE LION AND THE BULL,"A Lion saw a fine fat Bull pasturing among a herd of cattle and cast about for some means of getting him into his clutches; so he sent him word that he was sacrificing a sheep, and asked if he would do him the honour of dining with him. The Bull accepted the invitation, but, on arriving at the Lion's den, he saw a great array of saucepans and spits, but no sign of a sheep; so he turned on his heel and walked quietly away. The Lion called after him in an injured tone to ask the reason, and the Bull turned round and said, ""I have reason enough. When I saw all your preparations it struck me at once that the victim was to be a Bull and not a sheep."" The net is spread in vain in sight of the bird.",,0.26532182,0.21383041,0.23290536,0.1828697,0.27327627,0.20780869,0.2714808,0.15746932,0.24298619,0.20518918,loyalty.virtue,0.27327627
143,"THE WOLF, THE FOX, AND THE APE","A Wolf charged a Fox with theft, which he denied, and the case was brought before an Ape to be tried. When he had heard the evidence on both sides, the Ape gave judgment as follows: ""I do not think,"" he said, ""that you, O Wolf, ever lost what you claim; but all the same I believe that you, Fox, are guilty of the theft, in spite of all your denials."" The dishonest get no credit, even if they act honestly.",,0.29966953,0.30068526,0.39640403,0.3530702,0.31790954,0.33895043,0.31920943,0.34379253,0.31651974,0.31078073,fairness.virtue,0.39640403
144,THE EAGLE AND THE COCKS,"There were two Cocks in the same farmyard, and they fought to decide who should be master. When the fight was over, the beaten one went and hid himself in a dark corner; while the victor flew up on to the roof of the stables and crowed lustily. But an Eagle espied him from high up in the sky, and swooped down and carried him off. Forthwith the other Cock came out of his corner and ruled the roost without a rival. Pride comes before a fall.",,0.28785384,0.2935705,0.3119589,0.31773064,0.37980014,0.33128464,0.3587966,0.2939962,0.30595466,0.30788043,loyalty.virtue,0.37980014
145,THE ESCAPED JACKDAW,"A Man caught a Jackdaw and tied a piece of string to one of its legs, and then gave it to his children for a pet. But the Jackdaw didn't at all like having to live with people; so, after a while, when he seemed to have become fairly tame and they didn't watch him so closely, he slipped away and flew back to his old haunts. Unfortunately, the string was still on his leg, and before long it got entangled in the branches of a tree and the Jackdaw couldn't get free, try as he would. He saw it was all up with him, and cried in despair, ""Alas, in gaining my freedom I have lost my life.""",,0.37190875,0.2984943,0.25966457,0.24390046,0.3180627,0.24692613,0.33565727,0.20399365,0.30538273,0.29999772,care.virtue,0.37190875
146,THE FARMER AND THE FOX,"A Farmer was greatly annoyed by a Fox, which came prowling about his yard at night and carried off his fowls. So he set a trap for him and caught him; and in order to be revenged upon him, he tied a bunch of tow to his tail and set fire to it and let him go. As ill-luck would have it, however, the Fox made straight for the fields where the corn was standing ripe and ready for cutting. It quickly caught fire and was all burnt up, and the Farmer lost all his harvest. Revenge is a two-edged sword.",,0.26832056,0.30960894,0.25729468,0.268011,0.3025565,0.26044273,0.28192374,0.21368882,0.24912196,0.30223948,care.vice,0.30960894
147,VENUS AND THE CAT,"A Cat fell in love with a handsome young man, and begged the goddess Venus to change her into a woman. Venus was very gracious about it, and changed her at once into a beautiful maiden, whom the young man fell in love with at first sight and shortly afterwards married. One day Venus thought she would like to see whether the Cat had changed her habits as well as her form; so she let a mouse run loose in the room where they were. Forgetting everything, the young woman had no sooner seen the mouse than up she jumped and was after it like a shot: at which the goddess was so disgusted that she changed her back again into a Cat.",,0.3297733,0.2925665,0.2862144,0.25405946,0.2536418,0.2915571,0.3265069,0.26551837,0.36195713,0.30215436,sanctity.virtue,0.36195713
148,THE CROW AND THE SWAN,"A Crow was filled with envy on seeing the beautiful white plumage of a Swan, and thought it was due to the water in which the Swan constantly bathed and swam. So he left the neighbourhood of the altars, where he got his living by picking up bits of the meat offered in sacrifice, and went and lived among the pools and streams. But though he bathed and washed his feathers many times a day, he didn't make them any whiter, and at last died of hunger into the bargain. You may change your habits, but not your nature.",,0.19965568,0.21800657,0.20019053,0.2256483,0.1952137,0.2213355,0.20913577,0.19870874,0.25610617,0.2997088,sanctity.vice,0.2997088
149,THE STAG WITH ONE EYE,"A Stag, blind of one eye, was grazing close to the sea-shore and kept his sound eye turned towards the land, so as to be able to perceive the approach of the hounds, while the blind eye he turned towards the sea, never suspecting that any danger would threaten him from that quarter. As it fell out, however, some sailors, coasting along the shore, spied him and shot an arrow at him, by which he was mortally wounded. As he lay dying, he said to himself, ""Wretch that I am! I bethought me of the dangers of the land, whence none assailed me: but I feared no peril from the sea, yet thence has come my ruin."" Misfortune often assails us from an unexpected quarter.",,0.27604192,0.31985015,0.27448723,0.27025774,0.27421615,0.26380113,0.29913658,0.26353726,0.30864236,0.32803455,sanctity.vice,0.32803455
150,THE FLY AND THE DRAUGHT-MULE,"A Fly sat on one of the shafts of a cart and said to the Mule who was pulling it, ""How slow you are! Do mend your pace, or I shall have to use my sting as a goad."" The Mule was not in the least disturbed. ""Behind me, in the cart,"" said he, ""sits my master. He holds the reins, and flicks me with his whip, and him I obey, but I don't want any of your impertinence. _I_ know when I may dawdle and when I may not.""",,0.2338809,0.23751266,0.23497422,0.31040484,0.2938872,0.29148665,0.3474645,0.30535674,0.28565803,0.31522527,authority.virtue,0.3474645
151,THE COCK AND THE JEWEL,"A Cock, scratching the ground for something to eat, turned up a Jewel that had by chance been dropped there. ""Ho!"" said he, ""a fine thing you are, no doubt, and, had your owner found you, great would his joy have been. But for me! give me a single grain of corn before all the jewels in the world.""",,0.3854168,0.28375596,0.31062216,0.27551055,0.31788093,0.25606978,0.35684362,0.23690186,0.39579532,0.35273305,sanctity.virtue,0.39579532
152,THE WOLF AND THE SHEPHERD,"A Wolf hung about near a flock of sheep for a long time, but made no attempt to molest them. The Shepherd at first kept a sharp eye on him, for he naturally thought he meant mischief: but as time went by and the Wolf showed no inclination to meddle with the flock, he began to look upon him more as a protector than as an enemy: and when one day some errand took him to the city, he felt no uneasiness at leaving the Wolf with the sheep. But as soon as his back was turned the Wolf attacked them and killed the greater number. When the Shepherd returned and saw the havoc he had wrought, he cried, ""It serves me right for trusting my flock to a Wolf.""",,0.27383855,0.2597828,0.21221502,0.19063397,0.2505381,0.22853361,0.22753751,0.1991657,0.21355505,0.23746565,care.virtue,0.27383855
153,THE FARMER AND THE STORK,"A Farmer set some traps in a field which he had lately sown with corn, in order to catch the cranes which came to pick up the seed. When he returned to look at his traps he found several cranes caught, and among them a Stork, which begged to be let go, and said, ""You ought not to kill me: I am not a crane, but a Stork, as you can easily see by my feathers, and I am the most honest and harmless of birds."" But the Farmer replied, ""It's nothing to me what you are: I find you among these cranes, who ruin my crops, and, like them, you shall suffer."" If you choose bad companions no one will believe that you are anything but bad yourself.",,0.23090987,0.24239361,0.22655496,0.21017061,0.255512,0.20791808,0.2324269,0.16480011,0.23036295,0.22521222,loyalty.virtue,0.255512
154,THE CHARGER AND THE MILLER,"A Horse, who had been used to carry his rider into battle, felt himself growing old and chose to work in a mill instead. He now no longer found himself stepping out proudly to the beating of the drums, but was compelled to slave away all day grinding the corn. Bewailing his hard lot, he said one day to the Miller, ""Ah me! I was once a splendid war-horse, gaily caparisoned, and attended by a groom whose sole duty was to see to my wants. How different is my present condition! I wish I had never given up the battlefield for the mill."" The Miller replied with asperity, ""It's no use your regretting the past","Fortune has many ups and downs: you must just take them as they come.""",0.31485465,0.34576073,0.3137579,0.32833567,0.36909303,0.35264084,0.3592875,0.34705567,0.3220652,0.32129866,loyalty.virtue,0.36909303
155,THE GRASSHOPPER AND THE OWL,"An Owl, who lived in a hollow tree, was in the habit of feeding by night and sleeping by day; but her slumbers were greatly disturbed by the chirping of a Grasshopper, who had taken up his abode in the branches. She begged him repeatedly to have some consideration for her comfort, but the Grasshopper, if anything, only chirped the louder. At last the Owl could stand it no longer, but determined to rid herself of the pest by means of a trick. Addressing herself to the Grasshopper, she said in her pleasantest manner, ""As I cannot sleep for your song, which, believe me, is as sweet as the notes of Apollo's lyre, I have a mind to taste some nectar, which Minerva gave me the other day. Won't you come in and join me?"" The Grasshopper was flattered by the praise of his song, and his mouth, too, watered at the mention of the delicious drink, so he said he would be delighted. No sooner had he got inside the hollow where the Owl was sitting than she pounced upon him and ate him up.",,0.29664195,0.20280503,0.1978335,0.21171395,0.22727208,0.21274318,0.2379513,0.21010633,0.2724155,0.2719213,care.virtue,0.29664195
156,THE GRASSHOPPER AND THE ANTS,"One fine day in winter some Ants were busy drying their store of corn, which had got rather damp during a long spell of rain. Presently up came a Grasshopper and begged them to spare her a few grains, ""For,"" she said, ""I'm simply starving."" The Ants stopped work for a moment, though this was against their principles. ""May we ask,"" said they, ""what you were doing with yourself all last summer? Why didn't you collect a store of food for the winter?"" ""The fact is,"" replied the Grasshopper, ""I was so busy singing that I hadn't the time."" ""If you spent the summer singing,"" replied the Ants, ""you can't do better than spend the winter dancing."" And they chuckled and went on with their work.",,0.16012427,0.19703753,0.16498269,0.15426041,0.18804249,0.15377797,0.19104806,0.19549556,0.2059471,0.21770898,sanctity.vice,0.21770898
157,THE FARMER AND THE VIPER,"One winter a Farmer found a Viper frozen and numb with cold, and out of pity picked it up and placed it in his bosom. The Viper was no sooner revived by the warmth than it turned upon its benefactor and inflicted a fatal bite upon him; and as the poor man lay dying, he cried, ""I have only got what I deserved, for taking compassion on so villainous a creature."" Kindness is thrown away upon the evil.",,0.48599803,0.36479443,0.31224754,0.21630478,0.2712498,0.27033162,0.34015536,0.23853607,0.37246108,0.34198442,care.virtue,0.48599803
