fable_number,title,text,moral,care.virtue,care.vice,fairness.virtue,fairness.vice,loyalty.virtue,loyalty.vice,authority.virtue,authority.vice,sanctity.virtue,sanctity.vice,dominant_moral,dominant_score
59,THE LAMP,"A Lamp, well filled with oil, burned with a clear and steady light, and began to swell with pride and boast that it shone more brightly than the sun himself. Just then a puff of wind came and blew it out. Some one struck a match and lit it again, and said, ""You just keep alight, and never mind the sun","Why, even the stars never need to be relit as you had to be just now.""",0.24862751,0.17722003,0.21073265,0.18959086,0.14113802,0.20362106,0.17254311,0.24532321,0.261288,0.21927461,sanctity.virtue,0.261288
60,THE OWL AND THE BIRDS,"The Owl is a very wise bird; and once, long ago, when the first oak sprouted in the forest, she called all the other Birds together and said to them, ""You see this tiny tree? If you take my advice, you will destroy it now when it is small: for when it grows big, the mistletoe will appear upon it, from which birdlime will be prepared for your destruction."" Again, when the first flax was sown, she said to them, ""Go and eat up that seed, for it is the seed of the flax, out of which men will one day make nets to catch you."" Once more, when she saw the first archer, she warned the Birds that he was their deadly enemy, who would wing his arrows with their own feathers and shoot them. But they took no notice of what she said: in fact, they thought she was rather mad, and laughed at her. When, however, everything turned out as she had foretold, they changed their minds and conceived a great respect for her wisdom. Hence, whenever she appears, the Birds attend upon her in the hope of hearing something that may be for their good. She, however, gives them advice no longer, but sits moping and pondering on the folly of her kind.",,0.28771913,0.24257945,0.26901707,0.24337167,0.30076018,0.24814267,0.33529472,0.26565987,0.33417267,0.27391386,authority.virtue,0.33529472
61,THE ASS IN THE LION'S SKIN,"An Ass found a Lion's Skin, and dressed himself up in it. Then he went about frightening every one he met, for they all took him to be a lion, men and beasts alike, and took to their heels when they saw him coming. Elated by the success of his trick, he loudly brayed in triumph. The Fox heard him, and recognised him at once for the Ass he was, and said to him, ""Oho, my friend, it's you, is it? I, too, should have been afraid if I hadn't heard your voice.""",,0.4235329,0.41268554,0.41622978,0.42513028,0.43890288,0.4188876,0.46484968,0.38601935,0.42675307,0.40843984,authority.virtue,0.46484968
62,THE SHE-GOATS AND THEIR BEARDS,"Jupiter granted beards to the She-Goats at their own request, much to the disgust of the he-Goats, who considered this to be an unwarrantable invasion of their rights and dignities. So they sent a deputation to him to protest against his action. He, however, advised them not to raise any objections. ""What's in a tuft of hair?"" said he. ""Let them have it if they want it","They can never be a match for you in strength.""",0.2694409,0.26718095,0.26315367,0.22096846,0.23718093,0.23879522,0.3209333,0.26307967,0.31258684,0.25610328,authority.virtue,0.3209333
63,THE OLD LION,"A Lion, enfeebled by age and no longer able to procure food for himself by force, determined to do so by cunning. Betaking himself to a cave, he lay down inside and feigned to be sick: and whenever any of the other animals entered to inquire after his health, he sprang upon them and devoured them. Many lost their lives in this way, till one day a Fox called at the cave, and, having a suspicion of the truth, addressed the Lion from outside instead of going in, and asked him how he did. He replied that he was in a very bad way: ""But,"" said he, ""why do you stand outside? Pray come in."" ""I should have done so,"" answered the Fox, ""if I hadn't noticed that all the footprints point towards the cave and none the other way.""",,0.34312764,0.37248302,0.35460755,0.35786092,0.37263915,0.3649,0.37509903,0.34775832,0.3752138,0.39623,sanctity.vice,0.39623
64,THE BOY BATHING,"A Boy was bathing in a river and got out of his depth, and was in great danger of being drowned. A man who was passing along a road heard his cries for help, and went to the riverside and began to scold him for being so careless as to get into deep water, but made no attempt to help him. ""Oh, sir,"" cried the Boy, ""please help me first and scold me afterwards."" Give assistance, not advice, in a crisis.",,0.29238522,0.14327131,0.15480113,0.08743389,0.12258733,0.10253628,0.14095853,0.122652546,0.16885638,0.093056075,care.virtue,0.29238522
65,THE QUACK FROG,"Once upon a time a Frog came forth from his home in the marshes and proclaimed to all the world that he was a learned physician, skilled in drugs and able to cure all diseases. Among the crowd was a Fox, who called out, ""You a doctor! Why, how can you set up to heal others when you cannot even cure your own lame legs and blotched and wrinkled skin?"" Physician, heal thyself.",,0.37721825,0.31632504,0.31933728,0.31744838,0.33352414,0.30976433,0.3543511,0.30101383,0.3690388,0.36907557,care.virtue,0.37721825
66,THE SWOLLEN FOX,"A hungry Fox found in a hollow tree a quantity of bread and meat, which some shepherds had placed there against their return. Delighted with his find he slipped in through the narrow aperture and greedily devoured it all. But when he tried to get out again he found himself so swollen after his big meal that he could not squeeze through the hole, and fell to whining and groaning over his misfortune. Another Fox, happening to pass that way, came and asked him what the matter was; and, on learning the state of the case, said, ""Well, my friend, I see nothing for it but for you to stay where you are till you shrink to your former size; you'll get out then easily enough.""",,0.24660403,0.24297683,0.2474207,0.23818906,0.24733813,0.23946191,0.22505555,0.22517964,0.25382444,0.2930569,sanctity.vice,0.2930569
67,"THE MOUSE, THE FROG, AND THE HAWK","A Mouse and a Frog struck up a friendship; they were not well mated, for the Mouse lived entirely on land, while the Frog was equally at home on land or in the water. In order that they might never be separated, the Frog tied himself and the Mouse together by the leg with a piece of thread. As long as they kept on dry land all went fairly well; but, coming to the edge of a pool, the Frog jumped in, taking the Mouse with him, and began swimming about and croaking with pleasure. The unhappy Mouse, however, was soon drowned, and floated about on the surface in the wake of the Frog. There he was spied by a Hawk, who pounced down on him and seized him in his talons. The Frog was unable to loose the knot which bound him to the Mouse, and thus was carried off along with him and eaten by the Hawk.",,0.2752866,0.20577177,0.21786393,0.26975498,0.30581167,0.24506544,0.2534525,0.2212806,0.22858296,0.26473206,loyalty.virtue,0.30581167
68,THE BOY AND THE NETTLES,"A Boy was gathering berries from a hedge when his hand was stung by a Nettle. Smarting with the pain, he ran to tell his mother, and said to her between his sobs, ""I only touched it ever so lightly, mother."" ""That's just why you got stung, my son,"" she said; ""if you had grasped it firmly, it wouldn't have hurt you in the least.""",,0.42021403,0.29285043,0.28383824,0.25158554,0.30701458,0.24645096,0.33265,0.20884602,0.32954964,0.25575337,care.virtue,0.42021403
69,THE PEASANT AND THE APPLE-TREE,"A Peasant had an Apple-tree growing in his garden, which bore no fruit, but merely served to provide a shelter from the heat for the sparrows and grasshoppers which sat and chirped in its branches. Disappointed at its barrenness he determined to cut it down, and went and fetched his axe for the purpose. But when the sparrows and the grasshoppers saw what he was about to do, they begged him to spare it, and said to him, ""If you destroy the tree we shall have to seek shelter elsewhere, and you will no longer have our merry chirping to enliven your work in the garden."" He, however, refused to listen to them, and set to work with a will to cut through the trunk. A few strokes showed that it was hollow inside and contained a swarm of bees and a large store of honey. Delighted with his find he threw down his axe, saying, ""The old tree is worth keeping after all."" Utility is most men's test of worth.",,0.34629077,0.31860137,0.31199962,0.29246205,0.30216718,0.29741383,0.3265068,0.29093364,0.35259882,0.3409908,sanctity.virtue,0.35259882
70,THE JACKDAW AND THE PIGEONS,"A Jackdaw, watching some Pigeons in a farmyard, was filled with envy when he saw how well they were fed, and determined to disguise himself as one of them, in order to secure a share of the good things they enjoyed. So he painted himself white from head to foot and joined the flock; and, so long as he was silent, they never suspected that he was not a pigeon like themselves. But one day he was unwise enough to start chattering, when they at once saw through his disguise and pecked him so unmercifully that he was glad to escape and join his own kind again. But the other jackdaws did not recognise him in his white dress, and would not let him feed with them, but drove him away: and so he became a homeless wanderer for his pains.",,0.24701491,0.20588247,0.22983305,0.29469857,0.29440212,0.30421203,0.2460766,0.24228293,0.26623383,0.29073265,loyalty.vice,0.30421203
71,JUPITER AND THE TORTOISE,"Jupiter was about to marry a wife, and determined to celebrate the event by inviting all the animals to a banquet. They all came except the Tortoise, who did not put in an appearance, much to Jupiter's surprise. So when he next saw the Tortoise he asked him why he had not been at the banquet. ""I don't care for going out,"" said the Tortoise; ""there's no place like home."" Jupiter was so much annoyed by this reply that he decreed that from that time forth the Tortoise should carry his house upon his back, and never be able to get away from home even if he wished to.",,0.2649661,0.2622538,0.23532376,0.22000965,0.30707508,0.25073132,0.31615505,0.26962596,0.31592464,0.2515636,authority.virtue,0.31615505
72,THE DOG IN THE MANGER,"A Dog was lying in a Manger on the hay which had been put there for the cattle, and when they came and tried to eat, he growled and snapped at them and wouldn't let them get at their food. ""What a selfish beast,"" said one of them to his companions; ""he can't eat himself and yet he won't let those eat who can.""",,0.13487995,0.1731325,0.1232341,0.15962164,0.16968979,0.16478707,0.14925615,0.14464559,0.1421492,0.19057415,sanctity.vice,0.19057415
73,THE TWO BAGS,"Every man carries Two Bags about with him, one in front and one behind, and both are packed full of faults. The Bag in front contains his neighbours' faults, the one behind his own","Hence it is that men do not see their own faults, but never fail to see those of others.",0.1496121,0.13787004,0.19773875,0.24026336,0.2001315,0.24681482,0.19674161,0.22519378,0.14651117,0.17448737,loyalty.vice,0.24681482
74,THE OXEN AND THE AXLETREES,"A pair of Oxen were drawing a heavily loaded waggon along the highway, and, as they tugged and strained at the yoke, the Axletrees creaked and groaned terribly. This was too much for the Oxen, who turned round indignantly and said, ""Hullo, you there! Why do you make such a noise when we do all the work?"" They complain most who suffer least.",,0.23970716,0.3430615,0.24523222,0.2722663,0.32717457,0.2681269,0.35127798,0.33517843,0.27617496,0.3053021,authority.virtue,0.35127798
75,THE BOY AND THE FILBERTS,"A Boy put his hand into a jar of Filberts, and grasped as many as his fist could possibly hold. But when he tried to pull it out again, he found he couldn't do so, for the neck of the jar was too small to allow of the passage of so large a handful. Unwilling to lose his nuts but unable to withdraw his hand, he burst into tears. A bystander, who saw where the trouble lay, said to him, ""Come, my boy, don't be so greedy: be content with half the amount, and you'll be able to get your hand out without difficulty."" Do not attempt too much at once.",,0.35778534,0.28694442,0.28894022,0.3256136,0.30193502,0.29627207,0.31946406,0.2748255,0.31692466,0.27565154,care.virtue,0.35778534
76,KING LOG,"Time was when the Frogs were discontented because they had no one to rule over them: so they sent a deputation to Jupiter to ask him to give them a King. Jupiter, despising the folly of their request, cast a log into the pool where they lived, and said that that should be their King. The Frogs were terrified at first by the splash, and scuttled away into the deepest parts of the pool; but by and by, when they saw that the log remained motionless, one by one they ventured to the surface again, and before long, growing bolder, they began to feel such contempt for it that they even took to sitting upon it. Thinking that a King of that sort was an insult to their dignity, they sent to Jupiter a second time, and begged him to take away the sluggish King he had given them, and to give them another and a better one. Jupiter, annoyed at being pestered in this way, sent a Stork to rule over them, who no sooner arrived among them than he began to catch and eat the Frogs as fast as he could.",,0.25064474,0.21090788,0.22154497,0.19586414,0.23183613,0.2325085,0.31021747,0.2675246,0.2922633,0.2455748,authority.virtue,0.31021747
77,THE OLIVE-TREE AND THE FIG-TREE,"An Olive-tree taunted a Fig-tree with the loss of her leaves at a certain season of the year. ""You,"" she said, ""lose your leaves every autumn, and are bare till the spring: whereas I, as you see, remain green and flourishing all the year round."" Soon afterwards there came a heavy fall of snow, which settled on the leaves of the Olive so that she bent and broke under the weight; but the flakes fell harmlessly through the bare branches of the Fig, which survived to bear many another crop.",,0.23626573,0.15975514,0.22403018,0.1875691,0.18916078,0.19831829,0.18974271,0.23083335,0.244674,0.23620784,sanctity.virtue,0.244674
78,THE LION AND THE BOAR,"One hot and thirsty day in the height of summer a Lion and a Boar came down to a little spring at the same moment to drink. In a trice they were quarrelling as to who should drink first. The quarrel soon became a fight and they attacked one another with the utmost fury. Presently, stopping for a moment to take breath, they saw some vultures seated on a rock above evidently waiting for one of them to be killed, when they would fly down and feed upon the carcase","The sight sobered them at once, and they made up their quarrel, saying, ""We had much better be friends than fight and be eaten by vultures.""",0.2618543,0.33583888,0.2893613,0.27717355,0.34752622,0.2964011,0.29637465,0.33226305,0.2788205,0.3163001,loyalty.virtue,0.34752622
79,THE WALNUT-TREE,"A Walnut-tree, which grew by the roadside, bore every year a plentiful crop of nuts. Every one who passed by pelted its branches with sticks and stones, in order to bring down the fruit, and the tree suffered severely","""It is hard,"" it cried, ""that the very persons who enjoy my fruit should thus reward me with insults and blows.""",0.14954126,0.19943367,0.1815235,0.17452182,0.23886164,0.15343976,0.19949551,0.1665995,0.16755302,0.2072565,loyalty.virtue,0.23886164
80,THE MAN AND THE LION,"A Man and a Lion were companions on a journey, and in the course of conversation they began to boast about their prowess, and each claimed to be superior to the other in strength and courage. They were still arguing with some heat when they came to a cross-road where there was a statue of a Man strangling a Lion. ""There!"" said the Man triumphantly, ""look at that! Doesn't that prove to you that we are stronger than you?"" ""Not so fast, my friend,"" said the Lion: ""that is only your view of the case. If we Lions could make statues, you may be sure that in most of them you would see the Man underneath."" There are two sides to every question.",,0.26185855,0.22778425,0.3150163,0.21108815,0.31761342,0.27964047,0.29508698,0.27863547,0.28072292,0.17827104,loyalty.virtue,0.31761342
81,THE TORTOISE AND THE EAGLE,"A Tortoise, discontented with his lowly life, and envious of the birds he saw disporting themselves in the air, begged an Eagle to teach him to fly. The Eagle protested that it was idle for him to try, as nature had not provided him with wings; but the Tortoise pressed him with entreaties and promises of treasure, insisting that it could only be a question of learning the craft of the air. So at length the Eagle consented to do the best he could for him, and picked him up in his talons. Soaring with him to a great height in the sky he then let him go, and the wretched Tortoise fell headlong and was dashed to pieces on a rock.",,0.31748113,0.3105648,0.28755495,0.2885108,0.3058657,0.30186617,0.32967448,0.31529868,0.33749685,0.36955926,sanctity.vice,0.36955926
82,THE KID ON THE HOUSETOP,"A Kid climbed up on to the roof of an outhouse, attracted by the grass and other things that grew in the thatch; and as he stood there browsing away, he caught sight of a Wolf passing below, and jeered at him because he couldn't reach him. The Wolf only looked up and said, ""I hear you, my young friend; but it is not you who mock me, but the roof on which you are standing.""",,0.18179686,0.18350677,0.12439417,0.21415964,0.16894446,0.19227508,0.14735627,0.2269427,0.1662346,0.21065502,authority.vice,0.2269427
83,THE FOX WITHOUT A TAIL,"A fox once fell into a trap, and after a struggle managed to get free, but with the loss of his brush. He was then so much ashamed of his appearance that he thought life was not worth living unless he could persuade the other Foxes to part with their tails also, and thus divert attention from his own loss. So he called a meeting of all the Foxes, and advised them to cut off their tails: ""They're ugly things anyhow,"" he said, ""and besides they're heavy, and it's tiresome to be always carrying them about with you."" But one of the other Foxes said, ""My friend, if you hadn't lost your own tail, you wouldn't be so keen on getting us to cut off ours.""",,0.35261443,0.37137428,0.3341219,0.28264326,0.33701795,0.29400262,0.3263087,0.2829681,0.3193739,0.34787217,care.vice,0.37137428
84,THE VAIN JACKDAW,"Jupiter announced that he intended to appoint a king over the birds, and named a day on which they were to appear before his throne, when he would select the most beautiful of them all to be their ruler. Wishing to look their best on the occasion they repaired to the banks of a stream, where they busied themselves in washing and preening their feathers. The Jackdaw was there along with the rest, and realised that, with his ugly plumage, he would have no chance of being chosen as he was: so he waited till they were all gone, and then picked up the most gaudy of the feathers they had dropped, and fastened them about his own body, with the result that he looked gayer than any of them. When the appointed day came, the birds assembled before Jupiter's throne; and, after passing them in review, he was about to make the Jackdaw king, when all the rest set upon the king-elect, stripped him of his borrowed plumes, and exposed him for the Jackdaw that he was.",,0.33616874,0.25938037,0.3034536,0.29873118,0.39456406,0.27321485,0.43528986,0.25309637,0.39010677,0.32996398,authority.virtue,0.43528986
85,THE TRAVELLER AND HIS DOG,"A Traveller was about to start on a journey, and said to his Dog, who was stretching himself by the door, ""Come, what are you yawning for? Hurry up and get ready: I mean you to go with me."" But the Dog merely wagged his tail and said quietly, ""I'm ready, master: it's you I'm waiting for.""",,0.26467377,0.2728458,0.24601734,0.29481468,0.31723532,0.3269128,0.34609136,0.27200684,0.31708464,0.29402575,authority.virtue,0.34609136
86,THE SHIPWRECKED MAN AND THE SEA,"A Shipwrecked Man cast up on the beach fell asleep after his struggle with the waves. When he woke up, he bitterly reproached the Sea for its treachery in enticing men with its smooth and smiling surface, and then, when they were well embarked, turning in fury upon them and sending both ship and sailors to destruction. The Sea arose in the form of a woman, and replied, ""Lay not the blame on me, O sailor, but on the Winds. By nature I am as calm and safe as the land itself: but the Winds fall upon me with their gusts and gales, and lash me into a fury that is not natural to me.""",,0.27155074,0.20125376,0.19974868,0.123419635,0.14980778,0.17970672,0.18484198,0.21059689,0.2490514,0.19536343,care.virtue,0.27155074
87,THE WILD BOAR AND THE FOX,"A Wild Boar was engaged in whetting his tusks upon the trunk of a tree in the forest when a Fox came by and, seeing what he was at, said to him, ""Why are you doing that, pray? The huntsmen are not out to-day, and there are no other dangers at hand that I can see."" ""True, my friend,"" replied the Boar, ""but the instant my life is in danger I shall need to use my tusks. There'll be no time to sharpen them then.""",,0.23737858,0.28159624,0.24563341,0.24931692,0.2571046,0.2198957,0.23827535,0.20335698,0.25943404,0.25888446,care.vice,0.28159624
88,MERCURY AND THE SCULPTOR,"Mercury was very anxious to know in what estimation he was held by mankind; so he disguised himself as a man and walked into a Sculptor's studio, where there were a number of statues finished and ready for sale. Seeing a statue of Jupiter among the rest, he inquired the price of it. ""A crown,"" said the Sculptor. ""Is that all?"" said he, laughing; ""and"" (pointing to one of Juno) ""how much is that one?"" ""That,"" was the reply, ""is half a crown."" ""And how much might you be wanting for that one over there, now?"" he continued, pointing to a statue of himself. ""That one?"" said the Sculptor; ""Oh, I'll throw him in for nothing if you'll buy the other two.""",,0.24890731,0.23972799,0.29072118,0.2900293,0.24147901,0.26856375,0.3010448,0.2408924,0.34105042,0.29124418,sanctity.virtue,0.34105042
89,THE FAWN AND HIS MOTHER,"A Hind said to her Fawn, who was now well grown and strong, ""My son, Nature has given you a powerful body and a stout pair of horns, and I can't think why you are such a coward as to run away from the hounds."" Just then they both heard the sound of a pack in full cry, but at a considerable distance","""You stay where you are,"" said the Hind; ""never mind me"": and with that she ran off as fast as her legs could carry her.",0.4296151,0.31692347,0.30097097,0.26344782,0.37719798,0.25352275,0.4050521,0.22979091,0.39671046,0.32560593,care.virtue,0.4296151
90,THE FOX AND THE LION,"A Fox who had never seen a Lion one day met one, and was so terrified at the sight of him that he was ready to die with fear. After a time he met him again, and was still rather frightened, but not nearly so much as he had been when he met him first. But when he saw him for the third time he was so far from being afraid that he went up to him and began to talk to him as if he had known him all his life.",,0.32750615,0.3108755,0.3044994,0.24584027,0.29373154,0.27698222,0.29171297,0.23822275,0.28421253,0.26614052,care.virtue,0.32750615
91,THE EAGLE AND HIS CAPTOR,"A Man once caught an Eagle, and after clipping his wings turned him loose among the fowls in his hen-house, where he moped in a corner, looking very dejected and forlorn. After a while his Captor was glad enough to sell him to a neighbour, who took him home and let his wings grow again. As soon as he had recovered the use of them, the Eagle flew out and caught a hare, which he brought home and presented to his benefactor. A fox observed this, and said to the Eagle, ""Don't waste your gifts on him! Go and give them to the man who first caught you; make _him_ your friend, and then perhaps he won't catch you and clip your wings a second time.""",,0.43061563,0.30096033,0.36729664,0.32321823,0.3477205,0.35051495,0.3707442,0.29058513,0.36261246,0.34841552,care.virtue,0.43061563
92,THE BLACKSMITH AND HIS DOG,"A Blacksmith had a little Dog, which used to sleep when his master was at work, but was very wide awake indeed when it was time for meals. One day his master pretended to be disgusted at this, and when he had thrown him a bone as usual, he said, ""What on earth is the good of a lazy cur like you? When I am hammering away at my anvil, you just curl up and go to sleep: but no sooner do I stop for a mouthful of food than you wake up and wag your tail to be fed."" Those who will not work deserve to starve.",,0.19260903,0.21438445,0.11385499,0.15411653,0.15273565,0.14332135,0.20303391,0.17609115,0.21605927,0.25661698,sanctity.vice,0.25661698
93,THE STAG AT THE POOL,"A thirsty Stag went down to a pool to drink. As he bent over the surface he saw his own reflection in the water, and was struck with admiration for his fine spreading antlers, but at the same time he felt nothing but disgust for the weakness and slenderness of his legs. While he stood there looking at himself, he was seen and attacked by a Lion; but in the chase which ensued, he soon drew away from his pursuer, and kept his lead as long as the ground over which he ran was open and free of trees. But coming presently to a wood, he was caught by his antlers in the branches, and fell a victim to the teeth and claws of his enemy. ""Woe is me!"" he cried with his last breath; ""I despised my legs, which might have saved my life: but I gloried in my horns, and they have proved my ruin."" What is worth most is often valued least.",,0.28665823,0.29089114,0.26613015,0.24112603,0.2274265,0.2458097,0.2739532,0.26972696,0.2879463,0.33346894,sanctity.vice,0.33346894
