fable_number,title,text,moral,care.virtue,care.vice,fairness.virtue,fairness.vice,loyalty.virtue,loyalty.vice,authority.virtue,authority.vice,sanctity.virtue,sanctity.vice,dominant_moral,dominant_score
215,THE GARDENER AND HIS DOG,"A Gardner's Dog fell into a deep well, from which his master used to draw water for the plants in his garden with a rope and a bucket. Failing to get the Dog out by means of these, the Gardener went down into the well himself in order to fetch him up. But the Dog thought he had come to make sure of drowning him; so he bit his master as soon as he came within reach, and hurt him a good deal, with the result that he left the Dog to his fate and climbed out of the well, remarking, ""It serves me quite right for trying to save so determined a suicide.""",,0.2542035,0.28233358,0.23898487,0.2976133,0.24857956,0.2769495,0.31939405,0.24160866,0.28174818,0.31180865,authority.virtue,0.31939405
216,THE RIVERS AND THE SEA,"Once upon a time all the Rivers combined to protest against the action of the Sea in making their waters salt. ""When we come to you,"" said they to the Sea, ""we are sweet and drinkable: but when once we have mingled with you, our waters become as briny and unpalatable as your own."" The Sea replied shortly, ""Keep away from me and you'll remain sweet.""",,0.3126086,0.17261267,0.2819152,0.20540926,0.29372513,0.22481826,0.26159784,0.26820984,0.313622,0.24356641,sanctity.virtue,0.313622
217,THE LION IN LOVE,"A Lion fell deeply in love with the daughter of a cottager and wanted to marry her; but her father was unwilling to give her to so fearsome a husband, and yet didn't want to offend the Lion; so he hit upon the following expedient. He went to the Lion and said, ""I think you will make a very good husband for my daughter: but I cannot consent to your union unless you let me draw your teeth and pare your nails, for my daughter is terribly afraid of them."" The Lion was so much in love that he readily agreed that this should be done. When once, however, he was thus disarmed, the Cottager was afraid of him no longer, but drove him away with his club.",,0.39396626,0.300193,0.32400402,0.26186273,0.38755164,0.3158682,0.39317617,0.24709782,0.36023855,0.29369867,care.virtue,0.39396626
218,THE BEE-KEEPER,"A Thief found his way into an apiary when the Bee-keeper was away, and stole all the honey. When the Keeper returned and found the hives empty, he was very much upset and stood staring at them for some time. Before long the bees came back from gathering honey, and, finding their hives overturned and the Keeper standing by, they made for him with their stings. At this he fell into a passion and cried, ""You ungrateful scoundrels, you let the thief who stole my honey get off scot-free, and then you go and sting me who have always taken such care of you!"" When you hit back make sure you have got the right man.",,0.30025932,0.24320744,0.176732,0.25011307,0.19616565,0.28293574,0.23869906,0.20187062,0.25510773,0.24851902,care.virtue,0.30025932
219,THE WOLF AND THE HORSE,"A Wolf on his rambles came to a field of oats, but, not being able to eat them, he was passing on his way when a Horse came along. ""Look,"" said the Wolf, ""here's a fine field of oats. For your sake I have left it untouched, and I shall greatly enjoy the sound of your teeth munching the ripe grain."" But the Horse replied, ""If wolves could eat oats, my fine friend, you would hardly have indulged your ears at the cost of your belly."" There is no virtue in giving to others what is useless to oneself.",,0.2342084,0.17113817,0.18953893,0.17923872,0.18985984,0.17829747,0.2096561,0.17717709,0.19998284,0.21157706,care.virtue,0.2342084
220,"THE BAT, THE BRAMBLE, AND THE SEAGULL","A Bat, a Bramble, and a Seagull went into partnership and determined to go on a trading voyage together. The Bat borrowed a sum of money for his venture; the Bramble laid in a stock of clothes of various kinds; and the Seagull took a quantity of lead: and so they set out. By and by a great storm came on, and their boat with all the cargo went to the bottom, but the three travellers managed to reach land. Ever since then the Seagull flies to and fro over the sea, and every now and then dives below the surface, looking for the lead he's lost; while the Bat is so afraid of meeting his creditors that he hides away by day and only comes out at night to feed; and the Bramble catches hold of the clothes of every one who passes by, hoping some day to recognise and recover the lost garments. All men are more concerned to recover what they lose than to acquire what they lack.",,0.29903024,0.22578536,0.22888334,0.2530887,0.3348552,0.26457584,0.2754204,0.17897013,0.24832281,0.2803397,loyalty.virtue,0.3348552
221,THE DOG AND THE WOLF,"A Dog was lying in the sun before a farmyard gate when a Wolf pounced upon him and was just going to eat him up; but he begged for his life and said, ""You see how thin I am and what a wretched meal I should make you now: but if you will only wait a few days my master is going to give a feast. All the rich scraps and pickings will fall to me and I shall get nice and fat: then will be the time for you to eat me."" The Wolf thought this was a very good plan and went away. Some time afterwards he came to the farmyard again, and found the Dog lying out of reach on the stable roof. ""Come down,"" he called, ""and be eaten: you remember our agreement?"" But the Dog said coolly, ""My friend, if ever you catch me lying down by the gate there again, don't you wait for any feast."" Once bitten, twice shy.",,0.1925473,0.16118185,0.1340155,0.1088845,0.15449432,0.1437686,0.16922411,0.14116499,0.189789,0.1736494,care.virtue,0.1925473
222,THE WASP AND THE SNAKE,"A Wasp settled on the head of a Snake, and not only stung him several times, but clung obstinately to the head of his victim. Maddened with pain the Snake tried every means he could think of to get rid of the creature, but without success. At last he became desperate, and crying, ""Kill you I will, even at the cost of my own life,"" he laid his head with the Wasp on it under the wheel of a passing waggon, and they both perished together.",,0.35638475,0.48221445,0.3279663,0.32792172,0.35139695,0.352668,0.3845156,0.30148405,0.38224185,0.44051716,care.vice,0.48221445
223,THE EAGLE AND THE BEETLE,"An Eagle was chasing a hare, which was running for dear life and was at her wits' end to know where to turn for help. Presently she espied a Beetle, and begged it to aid her. So when the Eagle came up the Beetle warned her not to touch the hare, which was under its protection. But the Eagle never noticed the Beetle because it was so small, seized the hare and ate her up. The Beetle never forgot this, and used to keep an eye on the Eagle's nest, and whenever the Eagle laid an egg it climbed up and rolled it out of the nest and broke it. At last the Eagle got so worried over the loss of her eggs that she went up to Jupiter, who is the special protector of Eagles, and begged him to give her a safe place to nest in: so he let her lay her eggs in his lap. But the Beetle noticed this and made a ball of dirt the size of an Eagle's egg, and flew up and deposited it in Jupiter's lap. When Jupiter saw the dirt, he stood up to shake it out of his robe, and, forgetting about the eggs, he shook them out too, and they were broken just as before. Ever since then, they say, Eagles never lay their eggs at the season when Beetles are about. The weak will sometimes find ways to avenge an insult, even upon the strong.",,0.31865105,0.26414767,0.22338937,0.21974833,0.25780022,0.25005814,0.27655485,0.23253928,0.280529,0.28884602,care.virtue,0.31865105
224,THE FOWLER AND THE LARK,"A Fowler was setting his nets for little birds when a Lark came up to him and asked him what he was doing. ""I am engaged in founding a city,"" said he, and with that he withdrew to a short distance and concealed himself. The Lark examined the nets with great curiosity, and presently, catching sight of the bait, hopped on to them in order to secure it, and became entangled in the meshes. The Fowler then ran up quickly and captured her. ""What a fool I was!"" said she: ""but at any rate, if that's the kind of city you are founding, it'll be a long time before you find fools enough to fill it.""",,0.27625042,0.30731153,0.274098,0.39669123,0.3735124,0.3465971,0.34982282,0.31282455,0.3188484,0.3889432,fairness.vice,0.39669123
225,THE FISHERMAN PIPING,"A Fisherman who could play the flute went down one day to the sea-shore with his nets and his flute; and, taking his stand on a projecting rock, began to play a tune, thinking that the music would bring the fish jumping out of the sea. He went on playing for some time, but not a fish appeared: so at last he threw down his flute and cast his net into the sea, and made a great haul of fish. When they were landed and he saw them leaping about on the shore, he cried, ""You rascals! you wouldn't dance when I piped: but now I've stopped, you can do nothing else!""",,0.22433147,0.21866985,0.22405402,0.23459838,0.29212487,0.2124688,0.25110596,0.21643543,0.22270924,0.25146675,loyalty.virtue,0.29212487
226,THE WEASEL AND THE MAN,"A Man once caught a Weasel, which was always sneaking about the house, and was just going to drown it in a tub of water, when it begged hard for its life, and said to him, ""Surely you haven't the heart to put me to death? Think how useful I have been in clearing your house of the mice and lizards which used to infest it, and show your gratitude by sparing my life."" ""You have not been altogether useless, I grant you,"" said the Man: ""but who killed the fowls? Who stole the meat? No, no! You do much more harm than good, and die you shall.""",,0.41824844,0.3634823,0.35196844,0.27757528,0.27331087,0.33393094,0.31316483,0.2970856,0.36712956,0.33216822,care.virtue,0.41824844
227,"THE PLOUGHMAN, THE ASS, AND THE OX","A Ploughman yoked his Ox and his Ass together, and set to work to plough his field. It was a poor makeshift of a team, but it was the best he could do, as he had but a single Ox. At the end of the day, when the beasts were loosed from the yoke, the Ass said to the Ox, ""Well, we've had a hard day: which of us is to carry the master home?"" The Ox looked surprised at the question. ""Why,"" said he, ""you, to be sure, as usual.""",,0.35745782,0.3317516,0.3477491,0.35540584,0.41408923,0.3564665,0.40863034,0.3352153,0.37537402,0.37911686,loyalty.virtue,0.41408923
228,DEMADES AND HIS FABLE,"Demades the orator was once speaking in the Assembly at Athens; but the people were very inattentive to what he was saying, so he stopped and said, ""Gentlemen, I should like to tell you one of Aesop's fables."" This made every one listen intently. Then Demades began: ""Demeter, a Swallow, and an Eel were once travelling together, and came to a river without a bridge: the Swallow flew over it, and the Eel swam across""; and then he stopped. ""What happened to Demeter?"" cried several people in the audience. ""Demeter,"" he replied, ""is very angry with you for listening to fables when you ought to be minding public business.""",,0.22453214,0.22426724,0.25592086,0.22849545,0.20832732,0.26750925,0.2553602,0.31457353,0.30364624,0.26889947,authority.vice,0.31457353
229,THE MONKEY AND THE DOLPHIN,"When people go on a voyage they often take with them lap-dogs or monkeys as pets to wile away the time. Thus it fell out that a man returning to Athens from the East had a pet Monkey on board with him. As they neared the coast of Attica a great storm burst upon them, and the ship capsized. All on board were thrown into the water, and tried to save themselves by swimming, the Monkey among the rest. A Dolphin saw him, and, supposing him to be a man, took him on his back and began swimming towards the shore. When they got near the Piraeus, which is the port of Athens, the Dolphin asked the Monkey if he was an Athenian. The Monkey replied that he was, and added that he came of a very distinguished family. ""Then, of course, you know the Piraeus,"" continued the Dolphin. The Monkey thought he was referring to some high official or other, and replied, ""Oh, yes, he's a very old friend of mine."" At that, detecting his hypocrisy, the Dolphin was so disgusted that he dived below the surface, and the unfortunate Monkey was quickly drowned.",,0.20353056,0.10837239,0.15578158,0.11578626,0.19887045,0.16065449,0.22241813,0.096114576,0.20434275,0.17636801,authority.virtue,0.22241813
230,THE CROW AND THE SNAKE,"A hungry Crow spied a Snake lying asleep in a sunny spot, and, picking it up in his claws, he was carrying it off to a place where he could make a meal of it without being disturbed, when the Snake reared its head and bit him. It was a poisonous Snake, and the bite was fatal, and the dying Crow said, ""What a cruel fate is mine! I thought I had made a lucky find, and it has cost me my life!""",,0.34871182,0.36118984,0.280977,0.28979173,0.3127139,0.27243838,0.33877584,0.22678752,0.33430123,0.36593294,sanctity.vice,0.36593294
231,THE DOGS AND THE FOX,"Some Dogs once found a lion's skin, and were worrying it with their teeth. Just then a Fox came by, and said, ""You think yourselves very brave, no doubt; but if that were a live lion you'd find his claws a good deal sharper than your teeth.""",,0.2684217,0.27658325,0.2760222,0.2156748,0.25155196,0.21663105,0.26582122,0.2368026,0.2745257,0.26523712,care.vice,0.27658325
232,THE NIGHTINGALE AND THE HAWK,"A Nightingale was sitting on a bough of an oak and singing, as her custom was. A hungry Hawk presently spied her, and darting to the spot seized her in his talons. He was just about to tear her in pieces when she begged him to spare her life: ""I'm not big enough,"" she pleaded, ""to make you a good meal: you ought to seek your prey among the bigger birds."" The Hawk eyed her with some contempt. ""You must think me very simple,"" said he, ""if you suppose I am going to give up a certain prize on the chance of a better of which I see at present no signs.""",,0.3255949,0.26627755,0.28843093,0.25370896,0.25585422,0.2466232,0.32243767,0.2548512,0.3302529,0.28943044,sanctity.virtue,0.3302529
233,THE ROSE AND THE AMARANTH,"A Rose and an Amaranth blossomed side by side in a garden, and the Amaranth said to her neighbour, ""How I envy you your beauty and your sweet scent! No wonder you are such a universal favourite."" But the Rose replied with a shade of sadness in her voice, ""Ah, my dear friend, I bloom but for a time: my petals soon wither and fall, and then I die","But your flowers never fade, even if they are cut; for they are everlasting.""",0.13017678,0.09370282,0.11506064,0.10379508,0.08421663,0.11595656,0.11733582,0.13811004,0.16960943,0.16872866,sanctity.virtue,0.16960943
234,"THE MAN, THE HORSE, THE OX, AND THE DOG","One winter's day, during a severe storm, a Horse, an Ox, and a Dog came and begged for shelter in the house of a Man. He readily admitted them, and, as they were cold and wet, he lit a fire for their comfort: and he put oats before the Horse, and hay before the Ox, while he fed the Dog with the remains of his own dinner. When the storm abated, and they were about to depart, they determined to show their gratitude in the following way. They divided the life of Man among them, and each endowed one part of it with the qualities which were peculiarly his own. The Horse took youth, and hence young men are high-mettled and impatient of restraint; the Ox took middle age, and accordingly men in middle life are steady and hard-working; while the Dog took old age, which is the reason why old men are so often peevish and ill-tempered, and, like dogs, attached chiefly to those who look to their comfort, while they are disposed to snap at those who are unfamiliar or distasteful to them.",,0.36125863,0.17678468,0.22454122,0.11622713,0.2719724,0.18943092,0.2863856,0.1402,0.2728141,0.17096055,care.virtue,0.36125863
235,"THE WOLVES, THE SHEEP, AND THE RAM","The Wolves sent a deputation to the Sheep with proposals for a lasting peace between them, on condition of their giving up the sheep-dogs to instant death. The foolish Sheep agreed to the terms; but an old Ram, whose years had brought him wisdom, interfered and said, ""How can we expect to live at peace with you? Why, even with the dogs at hand to protect us, we are never secure from your murderous attacks!""",,0.3406181,0.28562078,0.31273296,0.21171181,0.3215446,0.24785762,0.3276447,0.2323923,0.33744898,0.28398234,care.virtue,0.3406181
236,THE SWAN,"The Swan is said to sing but once in its life—when it knows that it is about to die. A certain man, who had heard of the song of the Swan, one day saw one of these birds for sale in the market, and bought it and took it home with him. A few days later he had some friends to dinner, and produced the Swan, and bade it sing for their entertainment: but the Swan remained silent. In course of time, when it was growing old, it became aware of its approaching end and broke into a sweet, sad song. When its owner heard it, he said angrily, ""If the creature only sings when it is about to die, what a fool I was that day I wanted to hear its song! I ought to have wrung its neck instead of merely inviting it to sing.""",,0.33334532,0.349344,0.33413482,0.29119104,0.33524835,0.303677,0.35977173,0.26338768,0.374302,0.38656417,sanctity.vice,0.38656417
237,THE SNAKE AND JUPITER,"A Snake suffered a good deal from being constantly trodden upon by man and beast, owing partly to the length of his body and partly to his being unable to raise himself above the surface of the ground: so he went and complained to Jupiter about the risks to which he was exposed. But Jupiter had little sympathy for him. ""I dare say,"" said he, ""that if you had bitten the first that trod on you, the others would have taken more trouble to look where they put their feet.""",,0.35718876,0.3518186,0.31694514,0.23572971,0.28306141,0.25827,0.31222227,0.26866704,0.30138955,0.30370483,care.virtue,0.35718876
238,THE WOLF AND HIS SHADOW,"A Wolf, who was roaming about on the plain when the sun was getting low in the sky, was much impressed by the size of his shadow, and said to himself, ""I had no idea I was so big. Fancy my being afraid of a lion! Why, I, not he, ought to be King of the beasts""; and, heedless of danger, he strutted about as if there could be no doubt at all about it. Just then a lion sprang upon him and began to devour him","""Alas,"" he cried, ""had I not lost sight of the facts, I shouldn't have been ruined by my fancies.""",0.19045341,0.18199195,0.167747,0.19491649,0.14377517,0.1914762,0.18959765,0.20050144,0.19601007,0.23503669,sanctity.vice,0.23503669
239,THE PLOUGHMAN AND THE WOLF,"A Ploughman loosed his oxen from the plough, and led them away to the water to drink. While he was absent a half-starved Wolf appeared on the scene, and went up to the plough and began chewing the leather straps attached to the yoke. As he gnawed away desperately in the hope of satisfying his craving for food, he somehow got entangled in the harness, and, taking fright, struggled to get free, tugging at the traces as if he would drag the plough along with him. Just then the Ploughman came back, and seeing what was happening, he cried, ""Ah, you old rascal, I wish you would give up thieving for good and take to honest work instead.""",,0.31649593,0.25005585,0.22149989,0.22628304,0.2361899,0.23892839,0.25807014,0.22504397,0.25596267,0.27418622,care.virtue,0.31649593
240,MERCURY AND THE MAN BITTEN BY AN ANT,"A Man once saw a ship go down with all its crew, and commented severely on the injustice of the gods. ""They care nothing for a man's character,"" said he, ""but let the good and the bad go to their deaths together."" There was an ant-heap close by where he was standing, and, just as he spoke, he was bitten in the foot by an Ant. Turning in a temper to the ant-heap he stamped upon it and crushed hundreds of unoffending ants. Suddenly Mercury appeared, and belaboured him with his staff, saying as he did so, ""You villain, where's your nice sense of justice now?""",,0.30251452,0.34852293,0.3177111,0.23496631,0.29116562,0.2734271,0.3359461,0.30193108,0.36491415,0.31934285,sanctity.virtue,0.36491415
241,THE WILY LION,"A Lion watched a fat Bull feeding in a meadow, and his mouth watered when he thought of the royal feast he would make, but he did not dare to attack him, for he was afraid of his sharp horns. Hunger, however, presently compelled him to do something: and as the use of force did not promise success, he determined to resort to artifice. Going up to the Bull in friendly fashion, he said to him, ""I cannot help saying how much I admire your magnificent figure. What a fine head! What powerful shoulders and thighs! But, my dear friend, what in the world makes you wear those ugly horns? You must find them as awkward as they are unsightly. Believe me, you would do much better without them."" The Bull was foolish enough to be persuaded by this flattery to have his horns cut off; and, having now lost his only means of defence, fell an easy prey to the Lion.",,0.2527133,0.26964933,0.21397,0.19905686,0.24012928,0.1970707,0.25871524,0.18683027,0.2444086,0.2458306,care.vice,0.26964933
242,THE PARROT AND THE CAT,"A Man once bought a Parrot and gave it the run of his house. It revelled in its liberty, and presently flew up on to the mantelpiece and screamed away to its heart's content. The noise disturbed the Cat, who was asleep on the hearthrug. Looking up at the intruder, she said, ""Who may you be, and where have you come from?"" The Parrot replied, ""Your master has just bought me and brought me home with him."" ""You impudent bird,"" said the Cat, ""how dare you, a newcomer, make a noise like that? Why, I was born here, and have lived here all my life, and yet, if I venture to mew, they throw things at me and chase me all over the place."" ""Look here, mistress,"" said the Parrot, ""you just hold your tongue. My voice they delight in; but yours—yours is a perfect nuisance.""",,0.2656629,0.20309143,0.2047039,0.22150749,0.20104523,0.24850221,0.27245203,0.23265429,0.26320845,0.2617293,authority.virtue,0.27245203
243,THE STAG AND THE LION,"A Stag was chased by the hounds, and took refuge in a cave, where he hoped to be safe from his pursuers. Unfortunately the cave contained a Lion, to whom he fell an easy prey. ""Unhappy that I am,"" he cried, ""I am saved from the power of the dogs only to fall into the clutches of a Lion."" Out of the frying-pan into the fire.",,0.27692756,0.24523154,0.2053678,0.23055166,0.23613244,0.25971428,0.24917053,0.19473599,0.2371594,0.24688107,care.virtue,0.27692756
244,THE IMPOSTOR,"A certain man fell ill, and, being in a very bad way, he made a vow that he would sacrifice a hundred oxen to the gods if they would grant him a return to health. Wishing to see how he would keep his vow, they caused him to recover in a short time. Now, he hadn't an ox in the world, so he made a hundred little oxen out of tallow and offered them up on an altar, at the same time saying, ""Ye gods, I call you to witness that I have discharged my vow."" The gods determined to be even with him, so they sent him a dream, in which he was bidden to go to the sea-shore and fetch a hundred crowns which he was to find there. Hastening in great excitement to the shore, he fell in with a band of robbers, who seized him and carried him off to sell as a slave: and when they sold him a hundred crowns was the sum he fetched. Do not promise more than you can perform.",,0.36900005,0.25901723,0.28447488,0.18316436,0.28259188,0.23479442,0.32411486,0.19441338,0.3461061,0.23656707,care.virtue,0.36900005
245,THE DOGS AND THE HIDES,"Once upon a time a number of Dogs, who were famished with hunger, saw some Hides steeping in a river, but couldn't get at them because the water was too deep. So they put their heads together, and decided to drink away at the river till it was shallow enough for them to reach the Hides. But long before that happened they burst themselves with drinking.",,0.20663339,0.18427421,0.19022988,0.18921894,0.2477489,0.17806704,0.22627163,0.16602708,0.23302735,0.23624569,loyalty.virtue,0.2477489
246,"THE LION, THE FOX, AND THE ASS","A Lion, a Fox, and an Ass went out hunting together. They had soon taken a large booty, which the Lion requested the Ass to divide between them. The Ass divided it all into three equal parts, and modestly begged the others to take their choice; at which the Lion, bursting with fury, sprang upon the Ass and tore him to pieces. Then, glaring at the Fox, he bade him make a fresh division. The Fox gathered almost the whole in one great heap for the Lion's share, leaving only the smallest possible morsel for himself. ""My dear friend,"" said the Lion, ""how did you get the knack of it so well?"" The Fox replied, ""Me? Oh, I took a lesson from the Ass."" Happy is he who learns from the misfortunes of others.",,0.36384305,0.31446546,0.3585754,0.33935994,0.40698376,0.36529815,0.36871293,0.32169005,0.3473629,0.32865712,loyalty.virtue,0.40698376
